{
  "schema_version": "acs-p1-gate-runner-plan/1",
  "profile": "replace-with-measured-profile",
  "node_id": "replace-with-enrolled-node-id",
  "engineer": "replace-with-engineer-identity",
  "direction": "local-bidirectional",
  "expires_at": "2099-01-01T00:00:00+00:00",
  "core_version": "replace-with-core-version",
  "temporal_version": "replace-with-temporal-version",
  "postgresql_version": "replace-with-postgresql-version",
  "protocol_version": "replace-with-protocol-version",
  "credential_scope": "replace-with-credential-scope",
  "policy": "replace-with-policy-version",
  "harness_versions": {"codex": "replace", "opencode": "replace"},
  "driver_versions": {"codex": "replace", "opencode": "replace"},
  "runtime_profile": null,
  "scenarios": {
    "P1-DOMAIN-TRANSACTION": [],
    "P1-AUTH-REVOCATION": [],
    "P1-COMMAND-DEDUP": [],
    "P1-INBOX-ACK-LOSS": [],
    "P1-CORE-RESTART": [],
    "P1-NODE-RESTART": [],
    "P1-PROVIDER-RESTART": [],
    "P1-LEASE-FENCING": [],
    "P1-UNCERTAIN-EFFECT": [],
    "P1-STALE-BASELINE": [],
    "P1-PARTIAL-ARTIFACT": [],
    "P1-SURFACE-PARITY": [],
    "P1-CODEX-LIFECYCLE": [],
    "P1-OPENCODE-LIFECYCLE": [],
    "P1-HARNESS-REPLACEMENT": [],
    "P1-NATIVE-MULTIAGENT-OFF": [],
    "P1-IDENTITY-CONTINUITY": [],
    "P1-INTEGRATED-ACCEPTANCE": []
  },
  "prerequisites": {},
  "review": {}
}
